{"name":"SageTe Edge NEW","codename":"billie","formfactor":"phone","aliases":[],"doppelgangers":[],"user_actions":{"bootloader":{"title":"Reboot to Bootloader","description":"With the device powered off, press and hold the volume down and power buttons until the screen turns on. It should say 'Fastboot Mode' underneath the warning sign.","image":"phone_power_down","button":true},"recovery":{"title":"Reboot to Recovery","description":"With the device still at the 'Fastboot Mode' screen (if not, power off the device and press and hold volume down and power buttons until the screen turns on), select the 'Recovery Mode' option by using the volume buttons and press the power button to enter.","image":"phone_power_down","button":true},"downgrade_android":{"title":"Downgrade Android","description":"If the device is running an Android version above 10.0, you have to downgrade to the last 10.0 release. Please make sure to flash version OxygenOS_10.5.10 of the factory image before proceeding.","link":"https://onepluscommunityserver.com/list/Unbrick_Tools/OnePlus_Nord_N10_5G/EU_BE89BA/Q/OnePlus_Nord_N10_5G_EU_OxygenOS_10.5.10.zip"},"support":{"title":"Support","description":"For details about Sagetea Software support for the XFone, please head over to the Sagetea Support here.","link":"https://xfonemobile.com/contact-modern/"}},"unlock":["downgrade_android","support"],"handlers":{"bootloader_locked":{"actions":[{"fastboot:flashing_unlock":null}]}},"operating_systems":[{"name":"Ubuntu Touch","options":[{"var":"channel","name":"Channel","tooltip":"The release channel","link":"https://docs.ubports.com/en/latest/about/process/release-schedule.html","type":"select","remote_values":{"systemimage:channels":null}},{"var":"wipe","name":"Wipe Userdata","tooltip":"Wipe personal data","type":"checkbox"},{"var":"bootstrap","name":"Bootstrap","tooltip":"Flash system partitions using fastboot","type":"checkbox","value":true}],"prerequisites":[],"steps":[{"actions":[{"core:download":{"group":"firmware","files":[{"url":"https://github.com/rubencarneiro/billie/releases/download/1.0/boot.img","checksum":{"sum":"aefa73921e5594615f366066be81f5c35ba75dc27a4eb68131de281e58d66ee0","algorithm":"sha256"}},{"url":"https://github.com/rubencarneiro/billie/releases/download/1.0/recovery.img","checksum":{"sum":"94628ac05291bd330924634af29b7d66a403985f5805826017a2c95bfef7ac78","algorithm":"sha256"}},{"url":"https://github.com/rubencarneiro/billie/releases/download/1.0/dtbo.img","checksum":{"sum":"984f270a8edf8c8f8be10215e07a030dc9cd822929df6f1ff7c4a9b4ad897b05","algorithm":"sha256"}},{"url":"https://github.com/rubencarneiro/billie/releases/download/1.0/vbmeta.img","checksum":{"sum":"4f1b180cc3a485c4eb2d996010ef5a2bc307bba0178bfa5411c6fa7220819d83","algorithm":"sha256"}}]}}],"condition":{"var":"bootstrap","value":true}},{"actions":[{"adb:reboot":{"to_state":"bootloader"}}],"fallback":[{"core:user_action":{"action":"bootloader"}}],"condition":{"var":"bootstrap","value":true}},{"actions":[{"fastboot:flash":{"partitions":[{"partition":"boot","file":"boot.img","group":"firmware"},{"partition":"recovery","file":"recovery.img","group":"firmware"},{"partition":"dtbo","file":"dtbo.img","group":"firmware"},{"partition":"vbmeta","file":"vbmeta.img","group":"firmware","flags":["--disable-verity","--disable-verification"]}]}}],"condition":{"var":"bootstrap","value":true}},{"actions":[{"fastboot:format":{"partition":"userdata","type":"ext4"}}],"condition":{"var":"wipe","value":true}},{"actions":[{"core:user_action":{"action":"recovery"}}],"condition":{"var":"bootstrap","value":true}},{"actions":[{"adb:reboot":{"to_state":"recovery"}}],"fallback":[{"core:user_action":{"action":"recovery"}}],"condition":{"var":"bootstrap","value":false}},{"actions":[{"systemimage:install":null}]},{"actions":[{"adb:reboot":{"to_state":"recovery"}}],"fallback":[{"core:user_action":{"action":"recovery"}}]}],"slideshow":[]}]}