{"name":"XFONE","codename":"sargo","formfactor":"phone","aliases":[],"doppelgangers":[],"user_actions":{"bootloader":{"title":"Reboot to Bootloader","description":"With the device powered off, press and hold the volume down and power buttons until the screen turns on. It should say 'Fastboot Mode' underneath the warning sign.","image":"phone_power_down","button":true},"recovery":{"title":"Reboot to Recovery","description":"With the device still at the 'Fastboot Mode' screen (if not, power off the device and press and hold volume down and power buttons until the screen turns on), select the 'Recovery Mode' option by using the volume buttons and press the power button to enter.","image":"phone_power_down","button":true},"downgrade_android":{"title":"Downgrade Android","description":"If the device is running an Android version above 9.0, you have to downgrade to the last 9.0 release. Please make sure to flash version PQ3B.190801.002 of the factory image before proceeding.","link":"https://developers.google.com/android/images#sargo"},"support":{"title":"Support","description":"For details about Supporting Ubuntu Touch development.","link":"https://ubports.com/pt/join-us"}},"unlock":["downgrade_android","support"],"handlers":{"bootloader_locked":{"actions":[{"fastboot:flashing_unlock":null}]}},"operating_systems":[{"name":"Ubuntu Touch","options":[{"var":"channel","name":"Channel","tooltip":"The release channel","link":"https://docs.ubports.com/en/latest/about/process/release-schedule.html","type":"select","remote_values":{"systemimage:channels":null}},{"var":"wipe","name":"Wipe Userdata","tooltip":"Wipe personal data","type":"checkbox"},{"var":"bootstrap","name":"Bootstrap","tooltip":"Flash system partitions using fastboot","type":"checkbox","value":true}],"prerequisites":[],"steps":[{"actions":[{"core:download":{"group":"firmware","files":[{"url":"https://system-image.sageteamobile.com/images/sargo/boot.img","checksum":{"sum":"8feab953fe368d370db772844543eec01a1a4dc5fc0ea469c82be7ba22375f6b","algorithm":"sha256"}},{"url":"https://system-image.sageteamobile.com/images/sargo/dtbo.img","checksum":{"sum":"51e63686ee4bb15e1ddc296f8809996d645d114347daebacc561cf02d2bfce2d","algorithm":"sha256"}},{"url":"https://system-image.sageteamobile.com/images/sargo/vbmeta.img","checksum":{"sum":"854a2c2a5e82c2c49a5d9d62c70334002c7dcd9203f904952ff5fc43b2eac420","algorithm":"sha256"}}]}}],"condition":{"var":"bootstrap","value":true}},{"actions":[{"adb:reboot":{"to_state":"bootloader"}}],"fallback":[{"core:user_action":{"action":"bootloader"}}],"condition":{"var":"bootstrap","value":true}},{"actions":[{"fastboot:flash":{"partitions":[{"partition":"boot","file":"boot.img","group":"firmware"},{"partition":"dtbo","file":"dtbo.img","group":"firmware"},{"partition":"vbmeta","file":"vbmeta.img","group":"firmware","flags":["--disable-verity","--disable-verification"]}]}}],"condition":{"var":"bootstrap","value":true}},{"actions":[{"fastboot:format":{"partition":"userdata","type":"ext4"}}],"condition":{"var":"wipe","value":true}},{"actions":[{"core:user_action":{"action":"recovery"}}],"condition":{"var":"bootstrap","value":true}},{"actions":[{"adb:reboot":{"to_state":"recovery"}}],"fallback":[{"core:user_action":{"action":"recovery"}}],"condition":{"var":"bootstrap","value":false}},{"actions":[{"systemimage:install":null}]},{"actions":[{"adb:reboot":{"to_state":"recovery"}}],"fallback":[{"core:user_action":{"action":"recovery"}}]}],"slideshow":[]}]}